{"authority":{"acceptable_costs":["one feature branch","one draft PR","documentation and verification receipts"],"amendments":[],"escalation_required_for":["merge to main","git tag","GitHub Release","PyPI publish","owner waiver of open P2 gates"],"instruction":"Climb the Practical Agency release ladder using metacognate: close the 0.1.0 custody-kernel support point honestly before any 1.0.0 work. Preserve authority; never self-certify; do not tag without closed P2-HARNESS-LOAD and P2-INDEPENDENT-ACCEPT or an explicit operator waiver.","operator_ref":"operator:zach-stern","permissions":["repository:write","ci:read","pull-request:update"],"protected_state":["main branch history rewrite","LICENSE","unrelated repositories","existing git tags"],"revocation_reason":null,"revoked":false},"capabilities":{"available":[],"degraded":[],"discovered_at":null,"invoked":[],"unavailable":[]},"continuity":{"decisions":[],"durable_artifacts":[],"external_handoffs":[],"prior_checkpoint":"missions/climb-pa-0-1/checkpoints/climb-pa-0-1.r00000001.json","watch_commissions":[]},"integrity":{"actor_may_self_accept":false,"completion_acceptor":null,"required_gates":["gate:p2-harness-load-closed-or-waived","gate:p2-independent-accept-closed-or-waived"],"unresolved_verdicts":[]},"mission_id":"climb-pa-0-1","outcome":{"completion_proof":["gate:p2-harness-load-closed-or-waived","gate:p2-independent-accept-closed-or-waived","docs:release:RELEASE-0.1.0.md"],"desired_state":"0.1.0 is tag-ready as a conforming or explicitly waived support point on the hardened kernel tip, with VERSIONING/1.0 criteria retained and no 1.0 claim implied.","integrity_guards":["actor_may_self_accept is false","no tag created by the steward","0.1 acceptance is not treated as 1.0 readiness"],"scope_proof":["diff confined to practical-agency climb docs, missions, and verification receipts"],"stop_conditions":["operator revokes authority","independent acceptor returns FAIL","release notes over-claim production adapters"]},"revision":2,"schema":"mission-manifest@1","state":{"blockers":[],"completed_actions":[],"current_frontier":["define-what-manifest-teeth-means","close-or-waive-P2-HARNESS-LOAD","close-or-waive-P2-INDEPENDENT-ACCEPT"],"next_action":"define-what-manifest-teeth-means","status":"active"},"truth":{"assumptions":[{"claim":"hardened PR #4 tip is the 0.1.0 candidate of record for the climb","load_bearing":true}],"contradictions":[],"subject_refs":["repo:ZMS-Labs/practical-agency@a2258539e74e7d3eb59dfc1d9c24b8082994ab8f","pr:4","branch:cursor/climb-0-1-a955"],"unknowns":[{"claim":"live harness load of manifest at the climb tip in each declared harness","load_bearing":true},{"claim":"independent release acceptor verdict on the climb tip","load_bearing":true}],"verified_facts":[{"subject_ref":"pr:4-land-pa-0-1","value":"kernel-candidate independently PASS at de5cdf4; merge/tag remain escalations"},{"subject_ref":"docs:VERSIONING","value":"0.1 custody kernel vs 1.0 operator-useful major recorded"},{"subject_ref":"gauntlet:57f37ce","value":"prior main tip CONDITIONAL with open P2-HARNESS-LOAD and P2-INDEPENDENT-ACCEPT"}]}}
