{"authority":{"acceptable_costs":["one feature branch","one draft PR","documentation and verification receipts","design note docs/release/MANIFEST-TEETH.md","follow-on work toward live harness proof and one bounded receipted adapter"],"amendments":["Goal clarified 2026-08-08: reach a point where manifest has real teeth — worth using because it constrains and enables authorized agency in ways that are not reducible to a goal skill, todo list, or ordinary skilled agent. Closing 0.1.0 remains the first rung; teeth requires answering the load-bearing unknowns recorded in docs/release/MANIFEST-TEETH.md."],"escalation_required_for":["merge to main","git tag","GitHub Release","PyPI publish","owner waiver of open P2 gates","declare comparative efficacy","claim production adapter readiness"],"instruction":"Climb the Practical Agency release ladder using metacognate: close the 0.1.0 custody-kernel support point honestly before any 1.0.0 work. Preserve authority; never self-certify; do not tag without closed P2-HARNESS-LOAD and P2-INDEPENDENT-ACCEPT or an explicit operator waiver.","operator_ref":"operator:zach-stern","permissions":["repository:write","ci:read","pull-request:update"],"protected_state":["main branch history rewrite","LICENSE","unrelated repositories","existing git tags"],"revocation_reason":null,"revoked":false},"capabilities":{"available":[],"degraded":[],"discovered_at":null,"invoked":[],"unavailable":[]},"continuity":{"decisions":[{"action_ref":"operator:approve:climb-pa-0-1","actor_ref":"operator:zach-stern","kind":"material-action"},{"action_ref":"docs:release:MANIFEST-TEETH.md","actor_ref":"agent:implementer","kind":"material-action"}],"durable_artifacts":["missions/climb-pa-0-1/checkpoints/climb-pa-0-1.r00000001.json","operator:approve:climb-pa-0-1","docs:release:MANIFEST-TEETH.md","gate:manifest-teeth-definition-recorded"],"external_handoffs":[],"prior_checkpoint":"missions/climb-pa-0-1/checkpoints/climb-pa-0-1.r00000005.json","watch_commissions":[]},"integrity":{"actor_may_self_accept":false,"completion_acceptor":"agent:confirmer-independent","required_gates":["gate:p2-harness-load-closed-or-waived","gate:p2-independent-accept-closed-or-waived","gate:manifest-teeth-definition-recorded"],"unresolved_verdicts":[]},"mission_id":"climb-pa-0-1","outcome":{"completion_proof":["gate:p2-harness-load-closed-or-waived","gate:p2-independent-accept-closed-or-waived","docs:release:RELEASE-0.1.0.md","docs:release:MANIFEST-TEETH.md"],"desired_state":"0.1.0 is tag-ready as a conforming or explicitly waived support point on the hardened kernel tip; VERSIONING/1.0 criteria remain; and the operator-readable definition of what gives manifest real teeth (vs goal/todo/ordinary agent) is recorded with falsifiers and load-bearing unknowns.","integrity_guards":["actor_may_self_accept is false","no tag created by the steward","0.1 acceptance is not treated as 1.0 readiness"],"scope_proof":["diff confined to practical-agency climb docs, missions, and verification receipts"],"stop_conditions":["operator revokes authority","independent acceptor returns FAIL","release notes over-claim production adapters"]},"revision":6,"schema":"mission-manifest@1","state":{"blockers":[],"completed_actions":["operator-approved-climb-pa-0-1","docs:release:MANIFEST-TEETH.md"],"current_frontier":["close-or-waive-P2-HARNESS-LOAD","close-or-waive-P2-INDEPENDENT-ACCEPT"],"next_action":"close-or-waive-P2-HARNESS-LOAD","status":"active"},"truth":{"assumptions":[{"claim":"hardened PR #4 tip is the 0.1.0 candidate of record for the climb","load_bearing":true}],"contradictions":[],"subject_refs":["repo:ZMS-Labs/practical-agency@a2258539e74e7d3eb59dfc1d9c24b8082994ab8f","pr:4","branch:cursor/climb-0-1-a955"],"unknowns":[{"claim":"live harness load of manifest at the climb tip in each declared harness","load_bearing":true},{"claim":"independent release acceptor verdict on the climb tip","load_bearing":true},{"claim":"whether an operator mission with manifest is more defensible after interruption than the same work without it","load_bearing":true},{"claim":"whether at least one bounded adapter can emit an external durable receipt under authority","load_bearing":true},{"claim":"whether operators will invoke manifest rather than bypass it when consequential work appears","load_bearing":true}],"verified_facts":[{"subject_ref":"pr:4-land-pa-0-1","value":"kernel-candidate independently PASS at de5cdf4; merge/tag remain escalations"},{"subject_ref":"docs:VERSIONING","value":"0.1 custody kernel vs 1.0 operator-useful major recorded"},{"subject_ref":"gauntlet:57f37ce","value":"prior main tip CONDITIONAL with open P2-HARNESS-LOAD and P2-INDEPENDENT-ACCEPT"},{"subject_ref":"operator:approve:climb-pa-0-1","value":"operator:zach-stern approved climb-pa-0-1 in chat 2026-08-08 and set goal: manifest with real teeth"},{"subject_ref":"docs:release:MANIFEST-TEETH.md","value":"teeth definition recorded with four powers, falsifiers, and load-bearing unknowns"}]}}
