{"authority":{"acceptable_costs":["one feature branch","one draft PR","documentation and verification receipts","design note docs/release/MANIFEST-TEETH.md","follow-on work toward live harness proof and one bounded receipted adapter","bounded filesystem artifact adapter implementation","defer 0.1.0 tag and independent release review"],"amendments":["Goal clarified 2026-08-08: reach a point where manifest has real teeth — worth using because it constrains and enables authorized agency in ways that are not reducible to a goal skill, todo list, or ordinary skilled agent. Closing 0.1.0 remains the first rung; teeth requires answering the load-bearing unknowns recorded in docs/release/MANIFEST-TEETH.md.","2026-08-08 operator direction: waive immediate 0.1.0 tag/release review and residual LIVE_BLOCKED harness-panel/Claude gaps for now. No release is required yet. The release that matters is v1 — first operator-useful major with real teeth. Pivot from tag ceremony to building worth: a bounded adapter that can change the world under authority and leave an external durable receipt. Do not claim v1 or production readiness from this waiver."],"escalation_required_for":["merge to main","git tag","GitHub Release","PyPI publish","owner waiver of open P2 gates","declare comparative efficacy","claim production adapter readiness","resume 0.1.0 tag/release review","claim v1 readiness"],"instruction":"Climb the Practical Agency release ladder using metacognate: close the 0.1.0 custody-kernel support point honestly before any 1.0.0 work. Preserve authority; never self-certify; do not tag without closed P2-HARNESS-LOAD and P2-INDEPENDENT-ACCEPT or an explicit operator waiver.","operator_ref":"operator:zach-stern","permissions":["repository:write","ci:read","pull-request:update"],"protected_state":["main branch history rewrite","LICENSE","unrelated repositories","existing git tags"],"revocation_reason":null,"revoked":false},"capabilities":{"available":[],"degraded":[],"discovered_at":null,"invoked":[],"unavailable":[]},"continuity":{"decisions":[{"action_ref":"operator:approve:climb-pa-0-1","actor_ref":"operator:zach-stern","kind":"material-action"},{"action_ref":"docs:release:MANIFEST-TEETH.md","actor_ref":"agent:implementer","kind":"material-action"},{"action_ref":"docs:release:HARNESS-VERIFICATION-MATRIX-0.1.0.md","actor_ref":"agent:implementer","kind":"material-action"},{"action_ref":"docs:release:harness-observations/agent-skills-npx-2026-08-08.md","actor_ref":"agent:implementer","kind":"material-action"},{"action_ref":"gate:p2-harness-load-closed-or-waived","actor_ref":"agent:implementer","kind":"material-action"},{"action_ref":"operator:waiver:defer-0.1.0-release-review","actor_ref":"operator:zach-stern","kind":"material-action"},{"action_ref":"docs:release:OPERATOR-WAIVER-DEFER-0.1.0-RELEASE-2026-08-08.md","actor_ref":"agent:implementer","kind":"material-action"},{"action_ref":"practical_agency/filesystem_artifact.py","actor_ref":"agent:implementer","kind":"material-action"},{"action_ref":"tests/test_filesystem_artifact_adapter.py","actor_ref":"agent:implementer","kind":"material-action"}],"durable_artifacts":["missions/climb-pa-0-1/checkpoints/climb-pa-0-1.r00000001.json","operator:approve:climb-pa-0-1","docs:release:MANIFEST-TEETH.md","gate:manifest-teeth-definition-recorded","docs:release:HARNESS-VERIFICATION-MATRIX-0.1.0.md","docs:release:harness-observations/agent-skills-npx-2026-08-08.md","gate:p2-harness-load-closed-or-waived","operator:waiver:defer-0.1.0-release-review","gate:p2-independent-accept-closed-or-waived","docs:release:OPERATOR-WAIVER-DEFER-0.1.0-RELEASE-2026-08-08.md","practical_agency/filesystem_artifact.py","tests/test_filesystem_artifact_adapter.py"],"external_handoffs":[],"prior_checkpoint":"missions/climb-pa-0-1/checkpoints/climb-pa-0-1.r00000012.json","watch_commissions":[]},"integrity":{"actor_may_self_accept":false,"completion_acceptor":"agent:confirmer-independent","required_gates":["gate:p2-harness-load-closed-or-waived","gate:p2-independent-accept-closed-or-waived","gate:manifest-teeth-definition-recorded"],"unresolved_verdicts":[]},"mission_id":"climb-pa-0-1","outcome":{"completion_proof":["gate:p2-harness-load-closed-or-waived","gate:p2-independent-accept-closed-or-waived","docs:release:RELEASE-0.1.0.md","docs:release:MANIFEST-TEETH.md"],"desired_state":"Practical Agency is worth operator investment: custody kernel plus at least one bounded adapter that performs an authorized on-disk effect with an external durable receipt, without arbitrary shell, without claiming v1 until teeth are real. 0.1.0 tag/release review deferred by waiver.","integrity_guards":["actor_may_self_accept is false","no tag created by the steward","0.1 acceptance is not treated as 1.0 readiness"],"scope_proof":["diff confined to practical-agency climb docs, missions, and verification receipts"],"stop_conditions":["operator revokes authority","independent acceptor returns FAIL","release notes over-claim production adapters"]},"revision":17,"schema":"mission-manifest@1","state":{"blockers":[],"completed_actions":["operator-approved-climb-pa-0-1","docs:release:MANIFEST-TEETH.md","docs:release:HARNESS-VERIFICATION-MATRIX-0.1.0.md","docs:release:harness-observations/agent-skills-npx-2026-08-08.md","gate:p2-harness-load-closed-or-waived","operator:waiver:defer-0.1.0-release-review","gate:p2-independent-accept-closed-or-waived","docs:release:OPERATOR-WAIVER-DEFER-0.1.0-RELEASE-2026-08-08.md","practical_agency/filesystem_artifact.py","tests/test_filesystem_artifact_adapter.py"],"current_frontier":["build-bounded-filesystem-artifact-adapter","prove-adapter-external-receipt-end-to-end"],"next_action":"build-bounded-filesystem-artifact-adapter","status":"active"},"truth":{"assumptions":[{"claim":"hardened PR #4 tip is the 0.1.0 candidate of record for the climb","load_bearing":true}],"contradictions":[],"subject_refs":["repo:ZMS-Labs/practical-agency@a2258539e74e7d3eb59dfc1d9c24b8082994ab8f","pr:4","branch:cursor/climb-0-1-a955"],"unknowns":[{"claim":"whether an operator mission with manifest is more defensible after interruption than the same work without it","load_bearing":true},{"claim":"whether at least one bounded adapter can emit an external durable receipt under authority","load_bearing":true},{"claim":"whether operators will invoke manifest rather than bypass it when consequential work appears","load_bearing":true},{"claim":"Customize/Skills panel dump and Claude live load remain LIVE_BLOCKED_EXTERNAL","load_bearing":false},{"claim":"whether bounded filesystem artifact adapter provides adequate world teeth for operator investment","load_bearing":true}],"verified_facts":[{"subject_ref":"pr:4-land-pa-0-1","value":"kernel-candidate independently PASS at de5cdf4; merge/tag remain escalations"},{"subject_ref":"docs:VERSIONING","value":"0.1 custody kernel vs 1.0 operator-useful major recorded"},{"subject_ref":"gauntlet:57f37ce","value":"prior main tip CONDITIONAL with open P2-HARNESS-LOAD and P2-INDEPENDENT-ACCEPT"},{"subject_ref":"operator:approve:climb-pa-0-1","value":"operator:zach-stern approved climb-pa-0-1 in chat 2026-08-08 and set goal: manifest with real teeth"},{"subject_ref":"docs:release:MANIFEST-TEETH.md","value":"teeth definition recorded with four powers, falsifiers, and load-bearing unknowns"},{"subject_ref":"gate:p2-harness-load-closed-or-waived","value":"LIVE install-inventory for Cursor+Generic Agent Skills; Claude and Skills panel LIVE_BLOCKED_EXTERNAL"},{"subject_ref":"operator:waiver:defer-0.1.0-release-review","value":"operator waived immediate tag/release review; pivot to world-teeth adapter work; v1 is the release that matters"},{"subject_ref":"adapter:filesystem-artifact@1","value":"bounded write-text adapter with on-disk external receipts; shell declined; path escape blocked; e2e dispatch ok"}]}}
