{
  "schema": "mission-manifest@1",
  "mission_id": "mission-001",
  "revision": 1,
  "authority": {
    "operator_ref": "operator:test",
    "instruction": "Create and verify the example artifact.",
    "amendments": [],
    "permissions": ["repository:write"],
    "protected_state": ["unrelated files"],
    "acceptable_costs": ["one feature branch"],
    "escalation_required_for": ["destructive action"],
    "revoked": false,
    "revocation_reason": null
  },
  "outcome": {
    "desired_state": "The example artifact exists and validates.",
    "completion_proof": ["validator passes"],
    "integrity_guards": ["runtime reads the canonical artifact"],
    "scope_proof": ["diff contains only intended files"],
    "stop_conditions": ["operator revokes authority"]
  },
  "truth": {
    "subject_refs": ["repo:example@rev-1"],
    "verified_facts": [],
    "assumptions": [],
    "contradictions": [],
    "unknowns": []
  },
  "state": {
    "status": "draft",
    "completed_actions": [],
    "current_frontier": ["obtain approval"],
    "blockers": [],
    "next_action": "obtain approval"
  },
  "capabilities": {
    "discovered_at": null,
    "available": [],
    "invoked": [],
    "unavailable": [],
    "degraded": []
  },
  "continuity": {
    "prior_checkpoint": null,
    "durable_artifacts": [],
    "decisions": [],
    "external_handoffs": [],
    "watch_commissions": []
  },
  "integrity": {
    "actor_may_self_accept": false,
    "required_gates": [],
    "unresolved_verdicts": [],
    "completion_acceptor": null
  }
}
