{"authority":{"acceptable_costs":["one feature branch","one synthesis PR","spawned confirmer subagent"],"amendments":[],"escalation_required_for":["merge to main","git tag","PyPI publish","close upstream PRs #1 and #2"],"instruction":"Land Practical Agency 0.1 as a hardened mission kernel candidate by completing PR #1 and #2 responsibilities into one mergeable PR, finishing the sole public manifest skill, and obtaining independent confirmation before any release claim. Implementer may not self-certify material completion.","operator_ref":"operator:zach-stern","permissions":["repository:write","ci:read","pull-request:update"],"protected_state":["main branch history rewrite","LICENSE","unrelated repositories"],"revocation_reason":null,"revoked":false},"capabilities":{"available":[],"degraded":[],"discovered_at":null,"invoked":[],"unavailable":[]},"continuity":{"decisions":[],"durable_artifacts":[],"external_handoffs":[],"prior_checkpoint":"missions/land-pa-0-1/checkpoints/land-pa-0-1.r00000001.json","watch_commissions":[]},"integrity":{"actor_may_self_accept":false,"completion_acceptor":"agent:confirmer-independent","required_gates":["gate:unittest-101","gate:check_package","gate:check_contracts","gate:check_public_content","gate:ci-deterministic-kernel"],"unresolved_verdicts":[]},"mission_id":"land-pa-0-1","outcome":{"completion_proof":["pr:4@de5cdf4cee130a7750e9328fcecde54814ae63c5","ci:run:31230365670","tests:101-ok-with-pinned-upstream","confirmer:bc-9fc730e3-d6c1-57a4-8f32-7c00b35e598c:PASS"],"desired_state":"PR #4 on cursor/complete-manifest-kernel-243f is independently accepted as the 0.1 kernel candidate with green deterministic/package gates and a completed sole manifest skill.","integrity_guards":["actor_may_self_accept is false","independent confirmer did not author the implementation commits","no contents:write temporary CI workflows"],"scope_proof":["diff origin/main...de5cdf4 confined to practical-agency package surfaces"],"stop_conditions":["operator revokes authority","confirmer returns FAIL","CI turns red on head"]},"revision":2,"schema":"mission-manifest@1","state":{"blockers":[],"completed_actions":[],"current_frontier":["assemble proof bundle for independent confirmation"],"next_action":"assemble proof bundle for independent confirmation","status":"active"},"truth":{"assumptions":[{"claim":"operator designated this agent as implementer and another agent as confirmer","load_bearing":true}],"contradictions":[],"subject_refs":["repo:ZMS-Labs/practical-agency@de5cdf4cee130a7750e9328fcecde54814ae63c5","pr:4"],"unknowns":[{"claim":"live harness loading at installed revision","load_bearing":false},{"claim":"comparative efficacy vs ordinary skilled agent","load_bearing":false}],"verified_facts":[]}}
